{
  "$schema": "http://json-schema.org/draft-07/schema#",
  "title": "CompetitorHandoff",
  "description": "Validated handoff from serp-discover (Tool 1) to serp-compete (Tool 2). v1.1 adds the optional top-level `moz` block (moz_api_upgrade_spec_v1.md T.4); it is NOT in `required`, so a v1.0 producer still validates.",
  "type": "object",
  "additionalProperties": false,
  "required": [
    "schema_version",
    "source_run_id",
    "source_run_timestamp",
    "client_domain",
    "client_brand_names",
    "targets",
    "exclusions"
  ],
  "properties": {
    "schema_version": {
      "type": "string",
      "description": "1.0 = original contract; 1.1 adds the optional `moz` block."
    },
    "source_run_id": {
      "type": "string"
    },
    "source_run_timestamp": {
      "type": "string",
      "format": "date-time"
    },
    "client_domain": {
      "type": "string"
    },
    "client_brand_names": {
      "type": "array",
      "items": {
        "type": "string"
      }
    },
    "targets": {
      "type": "array",
      "items": {
        "type": "object",
        "additionalProperties": false,
        "required": [
          "url",
          "domain",
          "rank",
          "entity_type",
          "content_type",
          "title",
          "source_keyword",
          "primary_keyword_for_url"
        ],
        "properties": {
          "url": {
            "type": "string"
          },
          "domain": {
            "type": "string"
          },
          "rank": {
            "type": "integer"
          },
          "entity_type": {
            "type": "string"
          },
          "content_type": {
            "type": "string"
          },
          "title": {
            "type": "string"
          },
          "source_keyword": {
            "type": "string"
          },
          "primary_keyword_for_url": {
            "type": "string"
          }
        }
      }
    },
    "exclusions": {
      "type": "object",
      "additionalProperties": false,
      "required": [
        "client_urls_excluded",
        "omit_list_excluded",
        "omit_list_used"
      ],
      "properties": {
        "client_urls_excluded": {
          "type": "integer"
        },
        "omit_list_excluded": {
          "type": "integer"
        },
        "omit_list_used": {
          "type": "array",
          "items": {
            "type": "string"
          }
        }
      }
    },
    "moz": {
      "type": "object",
      "description": "Optional Moz competitor signals, keyed by competitor domain. Additive and absent-safe: a consumer that ignores it behaves exactly as it did on v1.0. Present only when moz.competitor.enabled is true.",
      "additionalProperties": false,
      "required": [
        "domains"
      ],
      "properties": {
        "generated_at": {
          "type": "string"
        },
        "locale": {
          "type": "string"
        },
        "scope": {
          "type": "string"
        },
        "domains": {
          "type": "object",
          "description": "domain -> signal block",
          "additionalProperties": {
            "type": "object",
            "additionalProperties": true,
            "required": [
              "data_available",
              "status"
            ],
            "properties": {
              "data_available": {
                "type": "boolean"
              },
              "status": {
                "type": "string"
              },
              "reason": {
                "type": "string"
              },
              "ranking_keywords": {
                "type": "object"
              },
              "anchor_texts": {
                "type": "object"
              }
            }
          }
        },
        "client": {
          "type": "object",
          "description": "The client's own Moz signals, for reference against the competitor scores. Optional; present only when moz.brand_authority is enabled.",
          "additionalProperties": false,
          "required": [
            "domain"
          ],
          "properties": {
            "domain": {
              "type": "string"
            },
            "brand_authority": {
              "type": "object"
            },
            "anchor_texts": {
              "type": "object",
              "description": "The client's own inbound anchor-text distribution. Present only when moz.competitor.client_anchor_texts is enabled. Carried here rather than in `domains` because the handoff excludes the client by design."
            }
          }
        }
      }
    }
  }
}
