{
  "schema_version": "1.0",
  "source_run_id": "20260504_202101",
  "source_run_timestamp": "2026-05-05T03:24:46Z",
  "client_domain": "livingsystems.ca",
  "client_brand_names": [
    "Living Systems"
  ],
  "targets": [
    {
      "url": "https://www.psychologytoday.com/ca/blog/platonic-psychology/202512/why-you-act-like-a-child-around-your-family",
      "domain": "www.psychologytoday.com",
      "rank": 1,
      "entity_type": "directory",
      "content_type": "guide",
      "title": "Why You Can Act Like a Child Around Your Family",
      "source_keyword": "why do I act differently around my family",
      "primary_keyword_for_url": "why do I act differently around my family"
    },
    {
      "url": "https://www2.gov.bc.ca/gov/content/safety/public-safety/protecting-children/keeping-kids-safe",
      "domain": "www2.gov.bc.ca",
      "rank": 1,
      "entity_type": "government",
      "content_type": "guide",
      "title": "Keeping kids safe from abuse in B.C. - Protecting children",
      "source_keyword": "why do I act differently around my family",
      "primary_keyword_for_url": "why do I act differently around my family"
    },
    {
      "url": "https://www.psychologytoday.com/ca/blog/the-baby-scientist/202212/why-does-my-kid-behave-better-for-other-people",
      "domain": "www.psychologytoday.com",
      "rank": 1,
      "entity_type": "directory",
      "content_type": "guide",
      "title": "Why Do Kids Seem to Behave for Everyone but Their ...",
      "source_keyword": "why do I act differently around my family",
      "primary_keyword_for_url": "why do I act differently around my family"
    },
    {
      "url": "https://www.reddit.com/r/vancouver/comments/a7va5a/vancouver_attitudes/",
      "domain": "www.reddit.com",
      "rank": 2,
      "entity_type": "media",
      "content_type": "other",
      "title": "Vancouver Attitudes?",
      "source_keyword": "why do I act differently around my family",
      "primary_keyword_for_url": "why do I act differently around my family"
    },
    {
      "url": "https://www.bccsu.ca/bc-recovery-services/",
      "domain": "www.bccsu.ca",
      "rank": 2,
      "entity_type": "nonprofit",
      "content_type": "guide",
      "title": "BC Recovery Services",
      "source_keyword": "why do I act differently around my family",
      "primary_keyword_for_url": "why do I act differently around my family"
    },
    {
      "url": "https://www.facebook.com/groups/2371202252/",
      "domain": "www.facebook.com",
      "rank": 2,
      "entity_type": "N/A",
      "content_type": "other",
      "title": "I LOVE THE RCMP",
      "source_keyword": "why do I act differently around my family",
      "primary_keyword_for_url": "why do I act differently around my family"
    },
    {
      "url": "https://www.quora.com/I-act-differently-when-I-m-around-my-family-and-different-when-Im-around-my-friends-but-I-dont-do-it-on-purpose-Does-this-make-me-a-hypocrite",
      "domain": "www.quora.com",
      "rank": 3,
      "entity_type": "N/A",
      "content_type": "other",
      "title": "I act differently when I'm around my family and ...",
      "source_keyword": "why do I act differently around my family",
      "primary_keyword_for_url": "why do I act differently around my family"
    },
    {
      "url": "https://www.heretohelp.bc.ca/audience/family-members?page=10",
      "domain": "www.heretohelp.bc.ca",
      "rank": 3,
      "entity_type": "N/A",
      "content_type": "other",
      "title": "Family members | Here to Help",
      "source_keyword": "why do I act differently around my family",
      "primary_keyword_for_url": "why do I act differently around my family"
    },
    {
      "url": "https://www.healthlinkbc.ca/mental-health-and-substance-use/mental-health/mental-health-supports-and-resources",
      "domain": "www.healthlinkbc.ca",
      "rank": 4,
      "entity_type": "counselling",
      "content_type": "guide",
      "title": "Mental health supports and resources",
      "source_keyword": "why do I act differently around my family",
      "primary_keyword_for_url": "why do I act differently around my family"
    },
    {
      "url": "https://askthepsych.com/atp/2013/07/10/i-seem-to-act-differently-in-each-social-circle-so-who-is-the-real-me/",
      "domain": "askthepsych.com",
      "rank": 4,
      "entity_type": "counselling",
      "content_type": "other",
      "title": "I Seem to Act Differently in Each Social Circle, So Who is ...",
      "source_keyword": "why do I act differently around my family",
      "primary_keyword_for_url": "why do I act differently around my family"
    },
    {
      "url": "https://counsellingbc.com/blog/why-early-life-relationships-influence-adulthood-attachment",
      "domain": "counsellingbc.com",
      "rank": 1,
      "entity_type": "directory",
      "content_type": "guide",
      "title": "Why Early Life Relationships Influence Adulthood Attachment",
      "source_keyword": "how childhood affects adult relationships",
      "primary_keyword_for_url": "how childhood affects adult relationships"
    },
    {
      "url": "https://willowtreecounselling.ca/counselling/areas-of-practice/relationship-issues/",
      "domain": "willowtreecounselling.ca",
      "rank": 1,
      "entity_type": "counselling",
      "content_type": "guide",
      "title": "Relationship Issues",
      "source_keyword": "how childhood affects adult relationships",
      "primary_keyword_for_url": "how childhood affects adult relationships"
    },
    {
      "url": "https://open.library.ubc.ca/media/stream/pdf/24/1.0071301/2",
      "domain": "open.library.ubc.ca",
      "rank": 1,
      "entity_type": "education",
      "content_type": "pdf",
      "title": "EXPERIENCES OF ADULT OFFSPRING OF PARENTS WITH ...",
      "source_keyword": "how childhood affects adult relationships",
      "primary_keyword_for_url": "how childhood affects adult relationships"
    },
    {
      "url": "https://www.psychologytoday.com/ca/blog/invisible-bruises/202507/how-childhood-coping-traits-affect-our-adult-relationships",
      "domain": "www.psychologytoday.com",
      "rank": 2,
      "entity_type": "directory",
      "content_type": "guide",
      "title": "How Childhood Coping Traits Affect Our Adult Relationships",
      "source_keyword": "how childhood affects adult relationships",
      "primary_keyword_for_url": "how childhood affects adult relationships"
    },
    {
      "url": "https://www.options.bc.ca/program/peace-children-youth-experiencing-violence",
      "domain": "www.options.bc.ca",
      "rank": 2,
      "entity_type": "nonprofit",
      "content_type": "other",
      "title": "PEACE For Children & Youth Experiencing Violence",
      "source_keyword": "how childhood affects adult relationships",
      "primary_keyword_for_url": "how childhood affects adult relationships"
    },
    {
      "url": "https://www.vch.ca/en/health-topics/child-and-youth-mental-health-and-substance-use",
      "domain": "www.vch.ca",
      "rank": 2,
      "entity_type": "N/A",
      "content_type": "other",
      "title": "Child and youth mental health and substance use",
      "source_keyword": "how childhood affects adult relationships",
      "primary_keyword_for_url": "how childhood affects adult relationships"
    },
    {
      "url": "https://med-fom-ubcmj.sites.olt.ubc.ca/files/2017/03/v8i1-news2.pdf",
      "domain": "med-fom-ubcmj.sites.olt.ubc.ca",
      "rank": 3,
      "entity_type": "education",
      "content_type": "pdf",
      "title": "The lasting effects of childhood trauma on mental health in ...",
      "source_keyword": "how childhood affects adult relationships",
      "primary_keyword_for_url": "how childhood affects adult relationships"
    },
    {
      "url": "https://www.safespacecounselling.ca/family-therapy",
      "domain": "www.safespacecounselling.ca",
      "rank": 3,
      "entity_type": "counselling",
      "content_type": "other",
      "title": "Family Therapy",
      "source_keyword": "how childhood affects adult relationships",
      "primary_keyword_for_url": "how childhood affects adult relationships"
    },
    {
      "url": "https://lotustherapy.ca/vancouver-aedp-therapy/",
      "domain": "lotustherapy.ca",
      "rank": 4,
      "entity_type": "counselling",
      "content_type": "news",
      "title": "Learn How Childhood Trauma Affects Us in Vancouver BC",
      "source_keyword": "how childhood affects adult relationships",
      "primary_keyword_for_url": "how childhood affects adult relationships"
    },
    {
      "url": "https://www.canada.ca/en/public-health/services/publications/health-risks-safety/trauma-violence-informed-approaches-policy-practice.html",
      "domain": "www.canada.ca",
      "rank": 4,
      "entity_type": "government",
      "content_type": "guide",
      "title": "Trauma and violence-informed approaches to policy ...",
      "source_keyword": "how childhood affects adult relationships",
      "primary_keyword_for_url": "how childhood affects adult relationships"
    },
    {
      "url": "https://anelegantmind.com/blog/why-do-i-keep-ending-up-in-the-same-relationship-patterns",
      "domain": "anelegantmind.com",
      "rank": 1,
      "entity_type": "counselling",
      "content_type": "other",
      "title": "Why Do I Keep Ending Up in the Same Relationship ...",
      "source_keyword": "repeating relationship patterns",
      "primary_keyword_for_url": "repeating relationship patterns"
    },
    {
      "url": "https://vcfi.ca/about-us/",
      "domain": "vcfi.ca",
      "rank": 1,
      "entity_type": "counselling",
      "content_type": "N/A",
      "title": "About Us",
      "source_keyword": "repeating relationship patterns",
      "primary_keyword_for_url": "repeating relationship patterns"
    },
    {
      "url": "https://alignedrelationshipcounselling.com/couples-counselling",
      "domain": "alignedrelationshipcounselling.com",
      "rank": 1,